{
  "schema_version": "1.0",
  "classification": "SYNTHETIC_NOT_EVIDENCE",
  "candidate_id": "orion-conflict-sbom-candidate",
  "release_id": "orion-conflict",
  "producer": "Orion Synthetic Devices",
  "name": "Orion Edge Controller",
  "version": "7.4.0-conflict-synthetic",
  "identifiers": [
    {"type": "SYNTHETIC_URN", "value": "urn:synthetic:orion:edge-controller:7.4.0-conflict", "algorithm": null},
    {"type": "COMPONENT_ROLE", "value": "ROOT_PRODUCT", "algorithm": null}
  ],
  "artifact_sha256": "7dd09b8e8d138a40ec7b8a8e3a1664cb17915ec41de50af16a84657d2c83d47e",
  "technical_status": "SYNTHETIC_RECONCILIATION_OPEN",
  "product_conformity_status": "NO_PRODUCT_CONFORMITY_STATUS",
  "manufacturer_release_authority": false,
  "cab_conclusion": false,
  "components": [
    {"candidate_id": "orion-app", "producer": "Orion Synthetic Devices", "name": "Orion Application", "version": "2.4.0", "identifiers": [{"type": "PURL", "value": "pkg:generic/orion-synthetic/orion-app@2.4.0", "algorithm": null}, {"type": "COMPONENT_ROLE", "value": "TOP_LEVEL", "algorithm": null}, {"type": "PROVENANCE", "value": "SYNTHETIC_BUILD_RECORD:build/app", "algorithm": null}, {"type": "OBSERVED_HASH", "value": "17b494fa12de446601c1400ae4b027822760ff30264c616077f6adea8f66f3a7", "algorithm": "SHA-256"}]},
    {"candidate_id": "orion-crypto", "producer": "Orion Synthetic Devices", "name": "Orion Crypto", "version": null, "identifiers": [{"type": "PURL", "value": "pkg:generic/orion-synthetic/orion-crypto", "algorithm": null}, {"type": "COMPONENT_ROLE", "value": "TRANSITIVE", "algorithm": null}, {"type": "PROVENANCE", "value": "CONFLICT_UNRESOLVED:orion-crypto", "algorithm": null}]},
    {"candidate_id": "orion-unknown-blob", "producer": null, "name": null, "version": null, "identifiers": [{"type": "COMPONENT_ROLE", "value": "UNKNOWN", "algorithm": null}, {"type": "PROVENANCE", "value": "UNKNOWN:artifact/unresolved-slot", "algorithm": null}, {"type": "OBSERVED_HASH", "value": "ff9cf6723536b8c6ec0ba019db79d959b9478c890d7cdf3709ebafedcd2e381b", "algorithm": "SHA-256"}]}
  ],
  "relationships": [
    {"from": "orion-root", "type": "CONTAINS", "to": "orion-app"},
    {"from": "orion-app", "type": "DEPENDS_ON", "to": "orion-crypto"},
    {"from": "orion-root", "type": "CONTAINS", "to": "orion-unknown-blob"}
  ],
  "reconciliation": {
    "status": "SYNTHETIC_RECONCILIATION_OPEN",
    "component_population_status": "SYNTHETIC_OPEN_SET",
    "conflicts": [
      {"candidate_id": "orion-crypto", "field": "version", "build_value": "1.0.0", "artifact_value": "9.9.9-artifact-conflict", "resolution": null}
    ],
    "unknowns": [
      {"candidate_id": "orion-unknown-blob", "field": "identity", "reason": "Artifact lane observed a hashed slot with no producer, name, version, or package identifier."}
    ],
    "limitations": ["No conflict was auto-resolved and no UNKNOWN field was guessed."],
    "evidence_inputs": ["orion-conflict-build-manifest", "orion-conflict-artifact-inventory"]
  }
}
